id,collection,dc.contributor.advisor,dc.contributor.advisor[],dc.contributor.author,dc.contributor.author[],dc.date.accessioned,dc.date.accessioned[],dc.date.available,dc.date.available[],dc.date.issued,dc.date.issued[],dc.description.abstract[],dc.description.abstract[es_MX],dc.description.provenance[en],dc.format[es_MX],dc.identifier.uri,dc.identifier.uri[],dc.language.iso[es_MX],dc.subject[],dc.subject[es_MX],dc.title[es_MX],dc.type[es_MX]
0da7d1ae-a513-4913-b2be-c8854b3439cc,20.500.11972/440,,"Cruz Domínguez, Ignacio",,"Romero Olmedo, Jairo",,2019-11-26T16:44:27Z,,2019-11-26T16:44:27Z,,2017,"El propósito de este artículo fue el desarrollo de una aplicación móvil, desarrollado en la plataforma Android para facilitar y beneficiar a los alumnos de la Universidad de Montemorelos, facilitando una mejor manera de saber cuántas calorías consumen diarias, saber su peso ideal, el rango en el que debería de estar su peso, y llevando un control de los alimentos que consumen a diario. Los resultados del prototipo fueron favorables, ya que se podrá alcanzar a la mayoría de usuarios posibles de la Universidad de Montemorelos. Gracias a que el sistema operativo Android es el más utilizado en el medio. La aplicación se conectó exitosamente a la base de datos permitiendo el funcionamiento correcto.",Ingeniería en Sistemas Computacionales,"Submitted by Nestor Ramírez (neraz@um.edu.mx) on 2019-11-26T16:44:27Z
No. of bitstreams: 1
Trabajo de titulación de Jairo Romero Olmedo.pdf: 321904 bytes, checksum: 00bfe66879ed239a7d32d7f7516e0b49 (MD5)||Made available in DSpace on 2019-11-26T16:44:27Z (GMT). No. of bitstreams: 1
Trabajo de titulación de Jairo Romero Olmedo.pdf: 321904 bytes, checksum: 00bfe66879ed239a7d32d7f7516e0b49 (MD5)
  Previous issue date: 2017",application/pdf,,https://dspace.um.edu.mx/handle/20.500.11972/1204,spa,Internet||Ayuda en alimentos||Dieta,Programación (computadores electrónicos),"Desarrollo de una aplicación para dispositivos móviles para registro, auto monitoreo y control de datos nutricionales y hábitos de salud.",info:eu-repo/semantics/bachelorThesis
05749260-007b-4567-8b7e-9709775c1bfc,20.500.11972/440,,"Rodríguez Antonio, Raúl||Piedra Noriega, Brenda Esther",,"Moreno Moscoso, Egan Endrei",,2019-11-26T16:31:05Z,,2019-11-26T16:31:05Z,,2017,"El objetivo de este artículo fue encontrar los factores predictores del porcentaje de humedad en proteína de soya texturizada: identificación y control. El sistema de medición del PHPST lo conforman el instrumento (Moisture Determination Balances - A&D 4714A) y los operadores del instrumento. Las muestras consistieron en 8 gramos de PST. Los factores predictores continuos que se identificaron a través del diagrama de Ishikawa fueron: X1: cantidad de agua añadida (ml), X2: temperatura del horno (°C), X3: velocidad del disco cortador (RPM), X4: temperatura ambiente (°C), X5: porcentaje de humedad ambiental, X6: porcentaje de humedad y volátiles en pasta (%), X7: porcentaje de aceite en la pasta (%) y  X8: porcentaje de fibra cruda (%). La variable de respuesta fue Y: PHPST. P.",Ingeniería Industrial y de Sistemas,"Submitted by Nestor Ramírez (neraz@um.edu.mx) on 2019-11-26T16:31:05Z
No. of bitstreams: 1
Trabajo de titulación de Egan Endrei Moreno Moscoso.pdf: 329974 bytes, checksum: 29e3b759e369d338583243aaf0b7bb43 (MD5)||Made available in DSpace on 2019-11-26T16:31:05Z (GMT). No. of bitstreams: 1
Trabajo de titulación de Egan Endrei Moreno Moscoso.pdf: 329974 bytes, checksum: 29e3b759e369d338583243aaf0b7bb43 (MD5)
  Previous issue date: 2017",application/pdf,,https://dspace.um.edu.mx/handle/20.500.11972/1203,spa,Procesos de manufactura,Control de calidad,Factores predictores del porcentaje de humedad en proteína de soya texturizada: identificación y control,info:eu-repo/semantics/bachelorThesis
608729d9-75ac-4bc3-bd7a-23ff5c9ac6b4,20.500.11972/440,,"García Mendoza, Alejandro Walterio",,"García Gordillo, Isaías",,2018-09-03T15:41:52Z,,2018-09-03T15:41:52Z,,1996,"En este trabajo de investigación se hace énfasis a la necesidad de producir software de calidad ya que este nos exige hacer uso de principios de ingeniería robustos, y de metodologías más innovadoras como lo es el MÉTODO/1 ya que está enfocada a una tecnología cliente/servidor.",Administración de Sistemas Computacionales,"Submitted by Dante Decanini (dante.decanini@udem.edu) on 2018-09-03T15:41:52Z
No. of bitstreams: 1
Tesis Isaias García Gordillo.pdf: 150116989 bytes, checksum: 37f883dc0515b9a04bd57f3d82c010b2 (MD5)||Made available in DSpace on 2018-09-03T15:41:52Z (GMT). No. of bitstreams: 1
Tesis Isaias García Gordillo.pdf: 150116989 bytes, checksum: 37f883dc0515b9a04bd57f3d82c010b2 (MD5)
  Previous issue date: 1996",application/pdf,,https://dspace.um.edu.mx/handle/20.500.11972/342,spa,,Análisis de sistemas||Diseño de sistemas||Programación (Computadoras electrónicas) - Lenguaje||Método fundation,Método fundation / I : metodología para cliente / servidor,info:eu-repo/semantics/bachelorThesis
394b4d13-02f2-4c5c-b3a0-cfda211193db,20.500.11972/440,,"Valle López, Jair Arody del",,"Muñoz Rodríguez, Jonhatan",,2019-10-29T21:16:08Z,,2019-10-29T21:16:08Z,,2014,"De acuerdo a la necesidad que la empresa manifiesta en lo que respecta a sus inventarios, esto a causa de no contar con información al día, por falta de un sistema que le proporcionara cierta información, se observó la necesidad de implementar un software que cubriera los requisitos que la empresa necesitaba, por tal motivo se investigó cotizaciones con una empresa privada que se dedican a realizar sistemas en base a la medida de la empresa, así también con una empresa que se dedica a ofrecer la instalación de un framework empresarial como lo es OpenERP. Considerando los resultados obtenidos de esta investigación se llegó a la conclusión que a la empresa UniUmart le conviene implementar un software OpenERP, ya que este software se puede adaptar a las necesidades que tiene la empresa y al presupuesto que tienen para poder adquirir un sistema empresarial.",Ingeniería en Sistemas Computacionales,"Submitted by Nestor Ramírez (neraz@um.edu.mx) on 2019-10-29T21:16:08Z
No. of bitstreams: 1
Proyecto de Jonhatan Muñoz Rodríguez.pdf: 1473900 bytes, checksum: 6824d2d65f1e7511c4fae89b23642005 (MD5)||Made available in DSpace on 2019-10-29T21:16:08Z (GMT). No. of bitstreams: 1
Proyecto de Jonhatan Muñoz Rodríguez.pdf: 1473900 bytes, checksum: 6824d2d65f1e7511c4fae89b23642005 (MD5)
  Previous issue date: 2014",application/pdf,,https://dspace.um.edu.mx/handle/20.500.11972/1163,spa,Innovaciones tecnológicas,Administración industrial,Impacto de la tecnologia ERP en la empresa UniUmart,info:eu-repo/semantics/bachelorThesis
f747978b-1e5b-475d-91be-bdaec6d969dd,20.500.11972/440,,"Baños Álvarez, Roberto Amos",,"Cruz Reyes, Elizabeth",,2019-10-29T17:19:22Z,,2019-10-29T17:19:22Z,,2014,"En esta investigación se implementó el software OpenERP, específicamente en los módulos de Almacén y Producción, a fin de observar si se puede obtener información integrada de estos departamentos, y si los reportes generados son útiles para la toma de decisiones. Con el fin de prevenir ciertas circunstancias, por ejemplo, cuando se produce más de lo requerido, o bien, la pérdida de oportunidad de vender a clientes por la falta de producción debido a la falta de previsión de materias primas. Como conclusión, el proceso de instalación de un sistema ERP, debe estar respaldado por la gerencia de la empresa. Los usuarios finales deben enfrentarse a una actualización proactiva que les facilite sus actividades. Se debe mantener una estrecha comunicación con la empresa. Esta exploración del sistema OpenERP, generó preguntas para posteriores investigaciones, como ¿qué procesos logran reducción de tiempo?, ¿La empresa ahorra dinero, con esta implementación?",Ingeniería en Sistemas Computacionales,"Submitted by Nestor Ramírez (neraz@um.edu.mx) on 2019-10-29T17:19:21Z
No. of bitstreams: 1
Proyecto de Elizabeth Cruz Reyes.pdf: 3321751 bytes, checksum: e35199c1e032588157e1fb2747b11b3b (MD5)||Made available in DSpace on 2019-10-29T17:19:22Z (GMT). No. of bitstreams: 1
Proyecto de Elizabeth Cruz Reyes.pdf: 3321751 bytes, checksum: e35199c1e032588157e1fb2747b11b3b (MD5)
  Previous issue date: 2014",application/pdf,,https://dspace.um.edu.mx/handle/20.500.11972/1158,spa,Control de la producción||Programas para computador,Administración industrial,"Implementación de los módulos almacén y producción del sistema OPENERP en una empresa textil al sur de Nuevo León, México",info:eu-repo/semantics/bachelorThesis
a8a1feb8-2a00-4b5c-83a5-e2e381dc8c06,20.500.11972/440,,"Díaz Valladares, Ramón Andrés",,"Chacón Galvis, Leonardo José",,2019-10-25T15:55:10Z,,2019-10-25T15:55:10Z,,2014,"El escenario del Data Center de la Universidad de Montemorelos se basa en servidores (máquinas físicas) donde se encuentran alojados diferentes servicios, los cuales requiere de una administración automatizada de los servidores y de toda la infraestructura del Data Center. Se puede apreciar un gran desaprovechamiento de los recursos de hardware de las máquinas con respecto a su almacenamiento, este se refiere a que mucho de las máquinas tiene espacios libres en sus discos duros y no están siendo aprovechados por otros servicios. En otras palabras espacio de almacenamiento desperdiciado. Para esta problemática se nota la carencia de un sistema de archi- 5 vos distribuido capaz de aprovechar estos espacios de almacenamiento libres y que tenga la capacidad de replicar datos a través de toda la red de almacenamiento distribuido.",Ingeniería en Tecnologías de Información y Comunicación,"Submitted by Nestor Ramírez (neraz@um.edu.mx) on 2019-10-25T15:55:10Z
No. of bitstreams: 1
Proyecto de Leonardo José Chacón Galvis.pdf: 1511133 bytes, checksum: da4564fc19583161d7be6367c006e35d (MD5)||Made available in DSpace on 2019-10-25T15:55:10Z (GMT). No. of bitstreams: 1
Proyecto de Leonardo José Chacón Galvis.pdf: 1511133 bytes, checksum: da4564fc19583161d7be6367c006e35d (MD5)
  Previous issue date: 2014",application/pdf,,https://dspace.um.edu.mx/handle/20.500.11972/1153,spa,Almacenamiento de información,Intranets (redes de computadores),Integración de tecnologías de virtualización y almacenamiento distribuido,info:eu-repo/semantics/bachelorThesis
8565756b-4db1-4f07-a243-71da25209a7f,20.500.11972/440,,"Kantún Montiel, Juana Rosaura",,"Gracida Hernández, Guillermo",,2019-11-22T18:23:46Z,,2019-11-22T18:23:46Z,,2017,"Este artículo presenta la recuperación de una señal de sonido a través de un mouse óptico usando el método de la triangulación óptica. Se realizaron pruebas de diferentes señales desde 10hz hasta 400 Hz, transmitidas por diferentes tipos de bocinas y emitidas por una programación hecha en MATLAB, aplicación móvil y grabación de voz de una persona.",Ingeniería en Electrónica y  Telecomunicaciones,"Submitted by Nestor Ramírez (neraz@um.edu.mx) on 2019-11-22T18:23:46Z
No. of bitstreams: 1
Trabajo de titulación de Guillermo Gracida Hernández.pdf: 482081 bytes, checksum: 1a74e8675bad077e7b3ef2fc58575ce5 (MD5)||Made available in DSpace on 2019-11-22T18:23:46Z (GMT). No. of bitstreams: 1
Trabajo de titulación de Guillermo Gracida Hernández.pdf: 482081 bytes, checksum: 1a74e8675bad077e7b3ef2fc58575ce5 (MD5)
  Previous issue date: 2017",application/pdf,,https://dspace.um.edu.mx/handle/20.500.11972/1200,spa,Óptica integrada,Audio digital,Sistema óptico para la recuperación de una señal de audio,info:eu-repo/semantics/bachelorThesis
beb06d07-f7d5-4f1c-88a7-48e23545e42d,20.500.11972/440,,"Valle López, Jair Arody del",,"Torres González, Myriam",,2019-11-20T17:03:44Z,,2019-11-20T17:03:44Z,,2016,En este proyecto se desarrolla una aplicación para que estudiantes de medicina aprendan la anatomía del corazón y logren identificar la ubicación del infarto agudo al miocardio mediante la interpretación de electrocardiogramas. El proyecto se desarrolló en unity una plataforma para el desarrollo de software de entretenimiento y se implementó el dispositivo de control gestual leap motion el cual es capaz de capturar con precisión los movimientos de la mano para interactuar con el corazón.,Ingeniería en Sistemas Computacionales,"Submitted by Nestor Ramírez (neraz@um.edu.mx) on 2019-11-20T17:03:44Z
No. of bitstreams: 1
Trabajo de titulación de Myriam Torres González.pdf: 931906 bytes, checksum: 240be7061e447530f85c47c95c1a7d76 (MD5)||Made available in DSpace on 2019-11-20T17:03:44Z (GMT). No. of bitstreams: 1
Trabajo de titulación de Myriam Torres González.pdf: 931906 bytes, checksum: 240be7061e447530f85c47c95c1a7d76 (MD5)
  Previous issue date: 2016",application/pdf,,https://dspace.um.edu.mx/handle/20.500.11972/1188,spa,Desarrollo de programas para computador||Enfermedades cardíacas||Infarto cardíaco,Realidad virtual,Aplicación de la realidad virtual para la ubicación del infarto agudo al miocardio,info:eu-repo/semantics/bachelorThesis
b74968ce-ee79-4e85-ac47-0a180b406b21,20.500.11972/440,,"Alférez Salinas, Germán Harvey",,"Cristofer Iván, Marín Vergara",,2019-11-13T20:41:46Z,,2019-11-13T20:41:46Z,,2015,"The objective of this study is to develop a software that detects melanoma in nevus in a way that is automatic, easy, noninvasive, objective and at a low cost using as the basis of the analysis the “ABCDE” of lesions along with the processing of images and artificial neural networks. The software’s evaluation was made with cases previously diagnosed with malignant melanoma and with cases of suspicious moles. The evaluation showed a sensibility of 76.56% and specificity in 87.58%",Ingeniería en Sistemas Computacionales,"Submitted by Nestor Ramírez (neraz@um.edu.mx) on 2019-11-13T20:41:46Z
No. of bitstreams: 1
Trabajos de titulación de Cristofer Iván  Marín  Vergara.pdf: 575665 bytes, checksum: e27ff8ec6bb8103507ce24d14102b802 (MD5)||Made available in DSpace on 2019-11-13T20:41:46Z (GMT). No. of bitstreams: 1
Trabajos de titulación de Cristofer Iván  Marín  Vergara.pdf: 575665 bytes, checksum: e27ff8ec6bb8103507ce24d14102b802 (MD5)
  Previous issue date: 2015",application/pdf,,https://dspace.um.edu.mx/handle/20.500.11972/1170,eng,Neoplasmas||Enfermedades de la piel||Programas para computador,Redes neurales (computadores),Software for the detection of melanoma through the recognition of images and artificial neural networks,info:eu-repo/semantics/bachelorThesis
7d153486-c09b-4998-aa2d-6f69edafb228,20.500.11972/440,,"Valle López, Jair Arody del",,"Ramírez Ascencio, Alvin",,2019-11-13T16:02:33Z,,2019-11-13T16:02:33Z,,2016,"Este estudio tiene el propósito de ilustrar algunas aventuras de la Biblia en realidad aumentada, además de fomentar el hábito de lectura de una manera más recreativa. Para crear la historia animada de la Biblia, se consideró analizar algunas de las historias bíblicas para decidir cuál se iba a implementar en la aplicación. Se creó una agenda y se dividió el trabajo por semanas para tener un plan de desarrollo de la aplicación. Al gestionar el proyecto y dividirlo por etapas y asignando el tiempo requerido para cada una de las etapas, ayudó a corregir cada uno de los elementos.  apk, que es un paquete para el dispositivo Android. Para poder instalarlo, se necesitó copiarlo al celular, dar permisos para poder instalar aplicaciones con orígenes desconocidos y luego se prosiguió a instalar la aplicación.",Ingeniería en Tecnologías de Información y Comunicación,"Submitted by Nestor Ramírez (neraz@um.edu.mx) on 2019-11-13T16:02:33Z
No. of bitstreams: 1
Trabajo de titulación de Alvin Ramírez Ascencio.pdf: 1187930 bytes, checksum: f201f5fcff1f12f2f2ac1ef74637e5d9 (MD5)||Made available in DSpace on 2019-11-13T16:02:33Z (GMT). No. of bitstreams: 1
Trabajo de titulación de Alvin Ramírez Ascencio.pdf: 1187930 bytes, checksum: f201f5fcff1f12f2f2ac1ef74637e5d9 (MD5)
  Previous issue date: 2016",application/pdf,,https://dspace.um.edu.mx/handle/20.500.11972/1164,spa,Biblia como literatura||Simulación por computadores,Libros electrónicos,Relatos bíblicos en realidad aumentada,info:eu-repo/semantics/bachelorThesis
c567bb76-9c4e-4af8-a745-e5a41ac6517a,20.500.11972/440,,"Valle López, Jair Arody del",,"Ramírez Ascencio, Erick",,2019-10-29T20:23:09Z,,2019-10-29T20:23:09Z,,2014,"El objetivo principal  de esta investigación es proponer una mayor seguridad a los sistemas informáticos de la Universidad de Montemorelos cubriendo todas las vulnerabilidades encontradas en los sistemas base del control académico y páginas web, a saber: (a) portal académico, (b) sistema e42 y (c) páginas web, como fit.um.edu.mx. Para lograr un incremento en la seguridad de los sistemas, se buscó encontrar vulnerabilidades a través de ataques tales como: (a) Phishing, (b) XSS, (c) Ingeniería Social, (d) Session Hijacking y (e) URL´s débiles. Después de que se realizaron las pruebas propuestas se encontraron diferentes vulnerabilidades en los sistemas, tanto a nivel software como a nivel usuario, se pudo corroborar que los sistemas académicos de la Universidad de Montemorelos cuentan con diferentes vulnerabilidades críticas.",Ingeniería en Tecnología de Información y Comunicación,"Submitted by Nestor Ramírez (neraz@um.edu.mx) on 2019-10-29T20:23:09Z
No. of bitstreams: 1
Proyecto de Erick Ramírez Ascencio.pdf: 1482468 bytes, checksum: 398163a16bdc83535971c185266cbe31 (MD5)||Made available in DSpace on 2019-10-29T20:23:09Z (GMT). No. of bitstreams: 1
Proyecto de Erick Ramírez Ascencio.pdf: 1482468 bytes, checksum: 398163a16bdc83535971c185266cbe31 (MD5)
  Previous issue date: 2014",application/pdf,,https://dspace.um.edu.mx/handle/20.500.11972/1161,spa,Sistemas de seguridad,Seguridad en computadores,Vulnerabilidades en los sistemas académicos y sitios de la Universidad de Montemorelos,info:eu-repo/semantics/bachelorThesis
ca1043d6-41f4-476b-8519-752bc4119dbc,20.500.11972/440,,"Baños Álvarez, Roberto Amos",,"Suárez Regalado, Diego  Alonso",,2019-10-25T15:06:26Z,,2019-10-25T15:06:26Z,,2014,"En el presente proyecto de investigación se caracterizó la temperatura y la humedad durante el proceso de fermentación en la panadería de la compañía de alimentos Colpac sede Montemorelos. Las constantes variaciones de volumen en el pan Bons o tipo barra halladas en las últimas producciones de pan, dieron como consecuencia constantes panes defectuosos los cuales eran excluidos del grupo destinado a la venta generando indirectamente pérdidas para la panadería. Se realizó un monitoreo al proceso de fermentación para recoger información relacionada a las probables causas de las variaciones de volumen halladas en el pan. Se observó que el sistema de calentamiento y humidificación no eran los más adecuados para alcanzar y mantener constantes las condiciones de fermentación óptimas durante el proceso. También se observó el ingreso frecuente del operador al cuarto de fermentación sin tomar las medidas correspondientes para prever la fuga de calor al exterior del cuarto. Por último, el cuarto no III posee un sistema de circulación del aire para la distribución homogénea del calor y la humedad en cada uno de los sectores del cuarto.",Ingeniería Industrial y de Sistemas,"Submitted by Nestor Ramírez (neraz@um.edu.mx) on 2019-10-25T15:06:26Z
No. of bitstreams: 1
Proyecto de Diego Alonso Suárez Regalado.pdf: 2265319 bytes, checksum: 709e7539b5f06dcddef27be1854132f0 (MD5)||Made available in DSpace on 2019-10-25T15:06:26Z (GMT). No. of bitstreams: 1
Proyecto de Diego Alonso Suárez Regalado.pdf: 2265319 bytes, checksum: 709e7539b5f06dcddef27be1854132f0 (MD5)
  Previous issue date: 2014",application/pdf,,https://dspace.um.edu.mx/handle/20.500.11972/1150,spa,Control de calidad,Ingeniería de la producción,Caracterización de la temperatura y humedad durante el proceso de fermentación de pan realizado en la compañía de alimentos Colpac sede Montemorelos.,info:eu-repo/semantics/bachelorThesis
d4169891-6ceb-41eb-85ec-b141e3112270,20.500.11972/440,,"Lemus Alonso, Gildardo Pablo||Kantún Montiel, Juana Rosaura||Rodríguez Antonio, Raúl||Romo Cárdenas, Gerardo Salvador",,"Domínguez Domínguez, Sydney",,2019-11-26T17:55:12Z,,2019-11-26T17:55:12Z,,2017,"El presente artículo se enfoca a la elaboración de un software de medición del espectro en LabVIEW para la obtención de los espectros de las longitudes de onda en el rango visible. El software se diseñó en base a la aproximación de color de longitud de onda (modelo RGB versus longitud de onda) dada por LabVIEW; con el modelo de aproximación fue posible transformar los colores extraídos de una imagen a longitud de onda y graficar sus valores con sus intensidades respectivas. Se encontró que en el rango de 380 a 644 nm el software desarrollado presentó un comportamiento similar al de un software de espectrómetro comercial en base a la prueba Student con un valor-p de 0.8934, aceptando la hipótesis nula de diferencia no significativa.",Ingeniería en Electrónica y Telecomunicación,"Submitted by Nestor Ramírez (neraz@um.edu.mx) on 2019-11-26T17:55:12Z
No. of bitstreams: 1
Trabajo de titulación de Sydney  Javier Domínguez-Domínguez.pdf: 438769 bytes, checksum: ed40a17fa6747af9bd66a25730c73a43 (MD5)||Made available in DSpace on 2019-11-26T17:55:12Z (GMT). No. of bitstreams: 1
Trabajo de titulación de Sydney  Javier Domínguez-Domínguez.pdf: 438769 bytes, checksum: ed40a17fa6747af9bd66a25730c73a43 (MD5)
  Previous issue date: 2017",application/pdf,,https://dspace.um.edu.mx/handle/20.500.11972/1206,spa,Dispositivos foto electrónicos,Programas para computador,Software de reconocimiento del espectro electromagnético en el rango visible a partir de una de imagen,info:eu-repo/semantics/bachelorThesis
34df0fe1-6117-4e7a-93f0-b95b3c9bc2cc,20.500.11972/440,,"Hernández Osoria, Saulo",,"Pet Martínez, Rudy",,2019-11-26T16:59:22Z,,2019-11-26T16:59:22Z,,2017,"El propósito de este artículo fue la elaboración de un sistema de control de dormitorios dentro de la Universidad de Montemorelos en el área de residencias estudiantiles era necesaria para la administración, el cual conllevaba una agilidad en el proceso de la distribución de habitaciones en cada uno de los cuatro dormitorios existentes. En este proyecto se utilizó la metodología de SCRUM. Las ventajas del software desarrollado son las siguientes:  El guardar la información dentro de las bases de datos de la Universidad hacen que sea segura Los dormitorios de la universidad de Montemorelos ahora cuentan con su sistema de distribución de cuartos.",Ingeniería en Tecnología de Información y Comunicación,"Submitted by Nestor Ramírez (neraz@um.edu.mx) on 2019-11-26T16:59:22Z
No. of bitstreams: 1
Trabajo de titulación de Rudy Adriel Pet Martínez.pdf: 650728 bytes, checksum: ffb2b74c455fa6d8edab0f9b9a222613 (MD5)||Made available in DSpace on 2019-11-26T16:59:22Z (GMT). No. of bitstreams: 1
Trabajo de titulación de Rudy Adriel Pet Martínez.pdf: 650728 bytes, checksum: ffb2b74c455fa6d8edab0f9b9a222613 (MD5)
  Previous issue date: 2017",application/pdf,,https://dspace.um.edu.mx/handle/20.500.11972/1205,spa,Administración de vivienda,Programas para computador,Sistema de control de dormitorios de la Universidad de Montemorelos,info:eu-repo/semantics/bachelorThesis
