id,collection,dc.contributor.advisor,dc.contributor.advisor[],dc.contributor.author,dc.contributor.author[],dc.date.accessioned,dc.date.accessioned[],dc.date.available,dc.date.available[],dc.date.issued,dc.date.issued[],dc.description.abstract[],dc.description.abstract[es_MX],dc.description.provenance[en],dc.format[es_MX],dc.identifier.uri,dc.identifier.uri[],dc.language.iso[es_MX],dc.subject[],dc.subject[es_MX],dc.title[es_MX],dc.type[es_MX]
9be79ae3-8845-4552-9ee0-42bd940e4f34,20.500.11972/441,"Hernández Rentería, Carlos  Emilio",,"Leiva Díaz, Rodrigo",,2021-06-03T20:00:12Z,,2021-06-03T20:00:12Z,,2020,,,Maestría en Ciencias Computacionales,"Submitted by Adriana Leuro (aleuro74@uan.edu.co) on 2021-06-03T20:00:12Z
No. of bitstreams: 1
TESIS DE MAESTRÍA EN CIENCIAS COMPUTACIONALES DE RODRIGO ENRIQUE LEIVA DÍAZ.pdf: 1768631 bytes, checksum: eca90ec15d9b38b924de95b03a81e6a1 (MD5)||Made available in DSpace on 2021-06-03T20:00:12Z (GMT). No. of bitstreams: 1
TESIS DE MAESTRÍA EN CIENCIAS COMPUTACIONALES DE RODRIGO ENRIQUE LEIVA DÍAZ.pdf: 1768631 bytes, checksum: eca90ec15d9b38b924de95b03a81e6a1 (MD5)
  Previous issue date: 2020",application/pdf,https://dspace.um.edu.mx/handle/20.500.11972/1355,,spa,,Pendiente por asignar,Propuesta de migración del protocolo de  comunicación en la Universidad  Adventista de Chile,info:eu-repo/semantics/masterThesis
bd36aaa9-4923-481d-951b-aa86dd4bfe85,20.500.11972/441,,"Hernández Osoria, Saulo",,"Moncada Gil, Alberto",,2018-09-11T20:00:24Z,,2018-09-11T20:00:24Z,,2004,"Este proyecto  de investigación resalta una propuesta resultante que constituye una guía para el desarrollo de software de evaluación del aprendizaje, ya que ofrece los requerimientos generales y la estructura de datos que los satisfacen, aunque deja en libertad a los desarrolladores para decidir mejor la implementación.",Maestría en Ciencias Computacionales,"Submitted by Lesly Montalvo (leslymontalvof@hotmail.com) on 2018-09-11T20:00:24Z
No. of bitstreams: 1
Tesis Alberto Moncada Gil.pdf: 98123230 bytes, checksum: 5e3d23c8d353c0c41bdea9bb5b1c3904 (MD5)||Made available in DSpace on 2018-09-11T20:00:24Z (GMT). No. of bitstreams: 1
Tesis Alberto Moncada Gil.pdf: 98123230 bytes, checksum: 5e3d23c8d353c0c41bdea9bb5b1c3904 (MD5)
  Previous issue date: 2004",application/pdf,,https://dspace.um.edu.mx/handle/20.500.11972/522,spa,,Programación (computadores electrónicos)||Evaluación educativa||Educación virtual,Propuesta de estándar de software de evalución del aprendizaje para la educación virtual,info:eu-repo/semantics/masterThesis
0fc8a7ce-2db7-4a8d-9401-13d72cac1106,20.500.11972/441,,"Díaz Valladares, Ramón Andrés",,"Chiquito Guzmán, Octavio",,2018-09-11T20:03:14Z,,2018-09-11T20:03:14Z,,2004,"Este proyecto aborda el problema al construir un producto multimedia, siguiendo metodologías ya establecidas y probadas.
Como resultado de las experiencias obtenidas se documentaron los procedimientos para la creación de productos multimedia enfocados a la educación en las universidades no como un producto para la venta.",Maestría en Ciencias Computacionales con Acentuación en Multimedia,"Submitted by Lesly Montalvo (leslymontalvof@hotmail.com) on 2018-09-11T20:03:14Z
No. of bitstreams: 1
Tesis Octavio Chiquito Guzmán (1).doc: 943616 bytes, checksum: b8f7dbf26399f30f16e4046bf8e55643 (MD5)||Made available in DSpace on 2018-09-11T20:03:14Z (GMT). No. of bitstreams: 1
Tesis Octavio Chiquito Guzmán (1).doc: 943616 bytes, checksum: b8f7dbf26399f30f16e4046bf8e55643 (MD5)
  Previous issue date: 2004",application/msword,,https://dspace.um.edu.mx/handle/20.500.11972/523,spa,,Sistemas multimedias||Educación superior||Métodos de enseñanza,Desarrollo e implementación de un sistema multimedia interactivo para facilitar la enseñanza universitaria : un enfoque metodológico,info:eu-repo/semantics/masterThesis
6e0029d7-c2e7-4bd7-9f87-c984010ae272,20.500.11972/441,,"Hernández Osoria, Saulo",,"Pet Martínez, Sheny Laudy",,2018-09-11T21:40:46Z,,2018-09-11T21:40:46Z,,2015,"En base a los puntos expuestos con anterioridad y la importancia de un sistema de comunicacin en una organización, el presente proyecto presenta un prototipo funcional basado en software libre que proporciona las mismas caractersticas de una central telefnica realizando funciones como: transferencia de llamadas, buzn de voz y contestador automÆtico.
Universidad de Montemorelos",Maestría en Ciencias Computacionales,"Submitted by Lesly Montalvo (leslymontalvof@hotmail.com) on 2018-09-11T21:40:46Z
No. of bitstreams: 1
Tesis Sheny Laudy Pet Martínez.pdf: 91958802 bytes, checksum: 7dd40d7d45733bac136e6539b7e3ca14 (MD5)||Made available in DSpace on 2018-09-11T21:40:46Z (GMT). No. of bitstreams: 1
Tesis Sheny Laudy Pet Martínez.pdf: 91958802 bytes, checksum: 7dd40d7d45733bac136e6539b7e3ca14 (MD5)
  Previous issue date: 2015",application/pdf,,https://dspace.um.edu.mx/handle/20.500.11972/538,spa,,Telecomunicaciones - Innovaciones tecnológicas,Implementación de una plataforma de telecomunicaciones VOIP,info:eu-repo/semantics/masterThesis
d02224a9-7487-4a5a-801d-76d5fa200bc8,20.500.11972/441,,"Díaz Valladares, Ramón Andrés",,"Rodríguez Herrera, Rosa Elisa",,2018-09-11T21:43:09Z,,2018-09-11T21:43:09Z,,2015,"En esta tesis se logró identificar los factores que han obstaculizado
la implementación de servicios móviles promovidos por la banca para el pago de productos
y/o servicios. Para dichos factores, se proporcionaron una serie de retos y oportunidades,
como propuesta base de mejoras, a las estrategias y desarrollos actuales
para los servicios de pagos móviles realizados en teléfonos inteligentes.",Maestría en Ciencias Computacionales,"Submitted by Lesly Montalvo (leslymontalvof@hotmail.com) on 2018-09-11T21:43:09Z
No. of bitstreams: 1
Tesis Rosa Elisa Rodríguez Herrera.pdf: 2676418 bytes, checksum: 30d1349f252f3383d85aead59e6c43ca (MD5)||Made available in DSpace on 2018-09-11T21:43:09Z (GMT). No. of bitstreams: 1
Tesis Rosa Elisa Rodríguez Herrera.pdf: 2676418 bytes, checksum: 30d1349f252f3383d85aead59e6c43ca (MD5)
  Previous issue date: 2015",application/pdf,,https://dspace.um.edu.mx/handle/20.500.11972/539,spa,,Innovaciones tecnológicas - Aspectos económicos||Telecomunicaciones - Innovaciones tecnológicas||Sistemas móviles de comunicación,Factores que obstaculizan la implementación de servicios móviles como medios de pago en el sector bancario de México,info:eu-repo/semantics/masterThesis
2eff4573-3b64-4bef-bed6-b9877f665df0,20.500.11972/441,,"Hernández Osoria, Saulo",,"Ancona Reyes, José Adair",,2018-09-11T21:45:13Z,,2018-09-11T21:45:13Z,,2015,"Al finalizar este proyecto se logró implementar una aplicación para iOS y un portal
web para administrar su contenido. Se adquirieron conocimientos funcionales sobre el
desarrollo de aplicaciones móviles nativas para iOS, tecnologías de desarrollo web y
la capacidad de utilizar estas herramientas para funcionar y trabajar en conjunto",Maestría en Ciencias Computacionales,"Submitted by Lesly Montalvo (leslymontalvof@hotmail.com) on 2018-09-11T21:45:13Z
No. of bitstreams: 1
Tesis José Adair Ancona Reyes.pdf: 5220652 bytes, checksum: d767506761bbf445d1261f7f1c2cdc4e (MD5)||Made available in DSpace on 2018-09-11T21:45:13Z (GMT). No. of bitstreams: 1
Tesis José Adair Ancona Reyes.pdf: 5220652 bytes, checksum: d767506761bbf445d1261f7f1c2cdc4e (MD5)
  Previous issue date: 2015",application/pdf,,https://dspace.um.edu.mx/handle/20.500.11972/540,spa,,Ingeniería de software||Enseñanza con ayuda de computadores||Tecnología educativa,Desarrollo de una aplicación nativa de enseñanza para IOS con SWIFT,info:eu-repo/semantics/masterThesis
812fba41-054c-4a19-8043-1ba14ae2b86e,20.500.11972/441,,"Alférez Salinas, Germán Harvey",,"Domínguez Domínguez, Rúsbel",,2018-09-11T21:49:04Z,,2018-09-11T21:49:04Z,,2017,"Esta tesis explica que mediante la aplicación de ciencia de datos y aprendizaje automático sobre datos
abiertos de la Secretaría de Salud de México, es posible clasificar a pacientes en las
siguientes dos causas de muerte: eclampsia durante el trabajo de parto o padecimiento
de hemorragia postparto, secundaria o tardía.",Maestría en Ciencias Computacionales,"Submitted by Lesly Montalvo (leslymontalvof@hotmail.com) on 2018-09-11T21:49:04Z
No. of bitstreams: 1
Tesis Rúsbel Domínguez Domínguez.pdf: 1981148 bytes, checksum: b1c7f70d9b232c52d15dd64d874bf62f (MD5)||Made available in DSpace on 2018-09-11T21:49:04Z (GMT). No. of bitstreams: 1
Tesis Rúsbel Domínguez Domínguez.pdf: 1981148 bytes, checksum: b1c7f70d9b232c52d15dd64d874bf62f (MD5)
  Previous issue date: 2017",application/pdf,,https://dspace.um.edu.mx/handle/20.500.11972/542,spa,,Procesamiento electrónico de datos||Mortalidad materna||Programas para computador,Aplicación de ciencia de datos para la creación de software predictivo de morbimortalidad materna en México,info:eu-repo/semantics/masterThesis
3e44c026-69f1-49bd-bc5c-b29128ed3fc5,20.500.11972/441,,"Hernández Rentería, Carlos Emilio",,"Robles López, Pedro",,2018-09-11T21:50:19Z,,2018-09-11T21:50:19Z,,2017,"Esta tesis establece que en relación con los temas planteados precedentemente y la importancia de los
cambios actuales en ciencia y tecnología, es imprescindible el desarrollo de un prototipo
de laboratorio de cómputo que optimice las herramientas computacionales disponibles
para afrontar los problemas que enfrentan los laboratorios de cómputo tradicionales.","Maestría en Ciencias Computacionales
Área de Redes Informáticas","Submitted by Lesly Montalvo (leslymontalvof@hotmail.com) on 2018-09-11T21:50:19Z
No. of bitstreams: 1
Tesis Pedro Robles López.pdf: 2205982 bytes, checksum: 006b45cc25542c89a2a7722c5c136e53 (MD5)||Made available in DSpace on 2018-09-11T21:50:19Z (GMT). No. of bitstreams: 1
Tesis Pedro Robles López.pdf: 2205982 bytes, checksum: 006b45cc25542c89a2a7722c5c136e53 (MD5)
  Previous issue date: 2017",application/pdf,,https://dspace.um.edu.mx/handle/20.500.11972/543,spa,,Computadores||Sistemas virtuales de computadores,Virtualización y tarjetas embebidas como núcleo de un laboratorio de cómputo,info:eu-repo/semantics/masterThesis
86893d90-7d38-4ddd-a5e1-f049783c61f1,20.500.11972/441,,"Díaz Valladares, Ramón Andrés",,"Escalante Guízar, Daniel Abraham",,2018-09-11T21:53:36Z,,2018-09-11T21:53:36Z,,2018,"En esta tesis se concluye que las guidelines del Department of Health and Human Services y la US General
Services Administration hacen referencia a que un sitio web representa el todo de una
organización, valorando cada una de sus áreas. Además, un sitio web debe ser dise-
ñado y estructurado de la mejor manera, permitiendo que la usabilidad establezca un
lazo de comunicación entre el usuario y la computadora.",Maestría en Ciencias Computacionales,"Submitted by Lesly Montalvo (leslymontalvof@hotmail.com) on 2018-09-11T21:53:36Z
No. of bitstreams: 1
Tesis Daniel Escalante Guízar.pdf: 19461351 bytes, checksum: 148c6ccd036738945a3ce69d5d8b1342 (MD5)||Made available in DSpace on 2018-09-11T21:53:36Z (GMT). No. of bitstreams: 1
Tesis Daniel Escalante Guízar.pdf: 19461351 bytes, checksum: 148c6ccd036738945a3ce69d5d8b1342 (MD5)
  Previous issue date: 2018",application/pdf,,https://dspace.um.edu.mx/handle/20.500.11972/544,spa,,Páginas web||Utilización,"Medición del nivel de usabilidad del sitio web de la Universidad de Montemorelos, durante el ciclo escolar 2011-2012",info:eu-repo/semantics/masterThesis
d5d6ee50-3535-46ab-9930-01d620fdd41d,20.500.11972/441,,"Alférez Salinas, Germán Harvey",,"González Hernández, Ceila Merari",,2018-09-11T21:55:45Z,,2018-09-11T21:55:45Z,,2018,"En esta tesis se propone crear un software basado en ciencia de datos, datos masivos, datos
abiertos, aprendizaje automático y la metodología de ciencia de datos de IBM, es
posible clasificar eventos sobre refugiados y lucha con artillería, basándose en un
conjunto de datos sobre Iraq, país perteneciente a la Ventana 10/40. El modelo
predictivo utilizado por el software que se generó mediante Decision Trees, presenta
valores arriba de 0.74 para accuracy, precision, recall y f1-score. Además, los
resultados coinciden con los ofrecidos en mapas oficiales.",Maestría en Ciencias Computacionales,"Submitted by Lesly Montalvo (leslymontalvof@hotmail.com) on 2018-09-11T21:55:45Z
No. of bitstreams: 1
Tesis Ceila Merari González.pdf: 6703220 bytes, checksum: 0fcfc180a3e8c13d3febbd78b0cfcb85 (MD5)||Made available in DSpace on 2018-09-11T21:55:45Z (GMT). No. of bitstreams: 1
Tesis Ceila Merari González.pdf: 6703220 bytes, checksum: 0fcfc180a3e8c13d3febbd78b0cfcb85 (MD5)
  Previous issue date: 2018",application/pdf,,https://dspace.um.edu.mx/handle/20.500.11972/545,spa,,Procesamiento electrónico de datos||Programas para computador,Software para la aplicación de ciencia de datos en la unión de medio oriente y norte de África : caso de estudio en Iraq,info:eu-repo/semantics/masterThesis
56f9f42d-937c-4ba7-960f-7b82a10e31c1,20.500.11972/441,,"Díaz Valladares, Ramón Andrés",,"Ancona García, Indira",,2018-09-11T20:43:18Z,,2018-09-11T20:43:18Z,,2005,"En este proyecto de investigación se concluye que dada la importancia que tiene la red en la empresa Telecomm/Telégrafos, al implementarse una
correcta administración para el manejo de la misma se obtendrá una mayor calidad de los servicios
que se prestan y la satisfacción de los clientes, todo lo cual se reflejará en el incremento de
productividad de servicio y se obtendrá un exitoso nivel de competitividad.",Maestría en Ciencias Computacionales,"Submitted by Lesly Montalvo (leslymontalvof@hotmail.com) on 2018-09-11T20:43:18Z
No. of bitstreams: 1
Tesis Indira Ancona García.pdf: 3776368 bytes, checksum: 211c10cf768862dc7921bee295f1e26f (MD5)||Made available in DSpace on 2018-09-11T20:43:18Z (GMT). No. of bitstreams: 1
Tesis Indira Ancona García.pdf: 3776368 bytes, checksum: 211c10cf768862dc7921bee295f1e26f (MD5)
  Previous issue date: 2005",application/pdf,,https://dspace.um.edu.mx/handle/20.500.11972/525,spa,,Telegrafía - Redes||Telecomunicaciones||Administración de redes - Telégrafos,Metodología de sistemas suaves: Un enfoque para la administración de la red de telecoom,info:eu-repo/semantics/masterThesis
d693b54e-7bec-44d9-9d6d-917dbe17c0e3,20.500.11972/441,,"Gutiérrez Colorado, Daniel Arturo",,"Huarca Condori, Moisés Heber",,2018-09-11T21:00:47Z,,2018-09-11T21:00:47Z,,2009,"Por medio de este proyecto se concluye que cumple en gran manera con las cuatro
características de todo sistema multimedia, puesto que las calificaciones individuales de cada
característica y el promedio de todo el proyecto se aproxima mucho a la máxima calificación
que es 100.",Maestría en Ciencias Computacionales,"Submitted by Lesly Montalvo (leslymontalvof@hotmail.com) on 2018-09-11T21:00:47Z
No. of bitstreams: 1
Tesis Moisés Heber Huarca Condori.pdf: 1338465 bytes, checksum: d252011f0c29a8db786d2956523ab121 (MD5)||Made available in DSpace on 2018-09-11T21:00:47Z (GMT). No. of bitstreams: 1
Tesis Moisés Heber Huarca Condori.pdf: 1338465 bytes, checksum: d252011f0c29a8db786d2956523ab121 (MD5)
  Previous issue date: 2009",application/pdf,,https://dspace.um.edu.mx/handle/20.500.11972/526,spa,,Enseñanza con ayuda de computadores||Tecnología educativa||Educación a distancia,Desarrollo e implementación de módulos de capacitación multimedia para la plataforma E42 del departamento de educación a distancia de la Universidad de Montemorelos,info:eu-repo/semantics/masterThesis
e146dfc4-ad3d-46b5-bf2b-dd696bf4c9ba,20.500.11972/441,,"Hernández Osoria, Saulo",,"Ramos Garduza, Jaime",,2018-09-11T21:04:46Z,,2018-09-11T21:04:46Z,,2010,"Los resultados de esta investigación demostraron una clara ventaja en cuanto a las variables tratadas
de la tecnología ethernet respecto a PLC. Cabe mencionar que cada una de las
tecnologías de redes tiene características muy particulares que las hacen específicas
para las exigencias actuales de comunicaciones y es en ese sentido donde sus
ventajas y desventajas deben ser aprovechadas como se advierte en los resultados
obtenidos en este trabajo.",Maestría en Ciencias Computacionales,"Submitted by Lesly Montalvo (leslymontalvof@hotmail.com) on 2018-09-11T21:04:46Z
No. of bitstreams: 1
Tesis Jaime Ramos Garduza (1).pdf: 1784841 bytes, checksum: e29a47ee94e3133436b455ad95318dee (MD5)||Made available in DSpace on 2018-09-11T21:04:46Z (GMT). No. of bitstreams: 1
Tesis Jaime Ramos Garduza (1).pdf: 1784841 bytes, checksum: e29a47ee94e3133436b455ad95318dee (MD5)
  Previous issue date: 2010",application/pdf,,https://dspace.um.edu.mx/handle/20.500.11972/527,spa,,Ethernet (Sistemas de redes de área local)||Redes de computadores||Sistemas de transmisión de datos,Comparación de eficiencia en velocidad de transferencia y caudal efectivo entre las tecnologias ethernet y FLC,info:eu-repo/semantics/masterThesis
3348049c-c58c-4297-a87f-ecf431cc59f3,20.500.11972/441,,"Gutiérrez Colorado, Daniel Arturo",,"Palomec Velázquez, Milka",,2018-09-11T21:20:08Z,,2018-09-11T21:20:08Z,,2011,"Con este proyecto se llega a la conclusión de que todo aquel que desea iniciar
con un proyecto similar, debe considerar varios aspectos importantes, como elegir
correctamente la metodología de desarrollo y de pruebas, conocimiento en edición de
video y sonido, contratar a un diseñador creativo, elegir el equipo técnico y el personal
que trabajará antes, durante y después de la producción.",Maestría en Ciencias Computacionales,"Submitted by Lesly Montalvo (leslymontalvof@hotmail.com) on 2018-09-11T21:20:08Z
No. of bitstreams: 1
Tesis Milka Palomec Velásquez.pdf: 1851374 bytes, checksum: e9c3ae76bae5c7d4f9e140c52a749e45 (MD5)||Made available in DSpace on 2018-09-11T21:20:08Z (GMT). No. of bitstreams: 1
Tesis Milka Palomec Velásquez.pdf: 1851374 bytes, checksum: e9c3ae76bae5c7d4f9e140c52a749e45 (MD5)
  Previous issue date: 2011",application/pdf,,https://dspace.um.edu.mx/handle/20.500.11972/530,spa,,Sistemas multimedia||Video digital,Desarrollo e implementación de un DVD multimedia interactivo: la historia de la Universidad de Linda Vista,info:eu-repo/semantics/masterThesis
df4416b8-ad05-4455-bf6d-92a7c20c8169,20.500.11972/441,,"Díaz Valladares, Ramón Andrés",,"Alvarado Ramos, Jesús",,2018-09-11T21:22:11Z,,2018-09-11T21:22:11Z,,2011,"El proyecto terminó presentando un prototipo funcional de los módulos básicos
del expediente clínico electrónico. Cada pieza de software se preparó de manera que
pudiera almacenar la información dentro de la arquitectura propuesta en el proyecto y
ofrecer al usuario del sistema la facilidad para crear una bitácora electrónica de los
servicios de salud que ofrece.",Maestría en Ciencias Computacionales,"Submitted by Lesly Montalvo (leslymontalvof@hotmail.com) on 2018-09-11T21:22:11Z
No. of bitstreams: 1
Tesis Jesús Alvarado Ramos.pdf: 1930584 bytes, checksum: 9844967d0e0fa0e86e1bc1764f87d7ad (MD5)||Made available in DSpace on 2018-09-11T21:22:11Z (GMT). No. of bitstreams: 1
Tesis Jesús Alvarado Ramos.pdf: 1930584 bytes, checksum: 9844967d0e0fa0e86e1bc1764f87d7ad (MD5)
  Previous issue date: 2011",application/pdf,,https://dspace.um.edu.mx/handle/20.500.11972/531,spa,,Programas para computador||Historias clínicas - Procesamiento de datos||Archivos de hospitales||Documentos electrónicos,Propuesta de modelo para un expediente clínico electrónico,info:eu-repo/semantics/masterThesis
bb625b5c-d762-4ead-9b52-89de9b90ff62,20.500.11972/441,,"Díaz Valladares, Ramón Andrés",,"Torres Flores, Carmina Lizeth",,2018-09-11T21:23:40Z,,2018-09-11T21:23:40Z,,2011,"Por medio de esta investigación se concluye que es una necesidad inminente la estandarización de un sistema de control escolar que
brinde las características de operatividad para los colegios, como valor agregado de la excelencia
académica con la que se cuenta, la atención de calidad por medio de un sistema de
control que les facilite la tarea a los involucrados en dichas organizaciones.
El verdadero éxito no está en el mejor software que ha comprado, desarrollado o en
la tecnología de punta que se haya implementado, sino en la forma en la que se le utilice.",Maestría en Ciencias Computacionales,"Submitted by Lesly Montalvo (leslymontalvof@hotmail.com) on 2018-09-11T21:23:40Z
No. of bitstreams: 1
Tesis Carmina Lizeth Torres Flores (1).pdf: 2711407 bytes, checksum: 812e4bd8a35eadc5d4d9b3e9ae69b825 (MD5)||Made available in DSpace on 2018-09-11T21:23:40Z (GMT). No. of bitstreams: 1
Tesis Carmina Lizeth Torres Flores (1).pdf: 2711407 bytes, checksum: 812e4bd8a35eadc5d4d9b3e9ae69b825 (MD5)
  Previous issue date: 2011",application/pdf,,https://dspace.um.edu.mx/handle/20.500.11972/532,spa,,Programas para computador||Sistemas de almacenamiento y recuperación de información||Administración escolar,Optimización de procesos a través de la estandarización de sofware en las instituciones educativas de nivel medio en la Unión Mexicana del Norte,info:eu-repo/semantics/masterThesis
79860352-ec5b-4d28-a1a0-39ee37e8a71d,20.500.11972/441,,"Gutiérrez Colorado, Daniel Arturo",,"Tass Herrera, Benjamín",,2018-09-11T21:27:38Z,,2018-09-11T21:27:38Z,,2011,"Por medio de este trabajo de investigación se logró un marco de procesos cuyos elementos constituyen una guía iterativa de actividades clasificadas por los enfoques previstos que ofrecieron requerimientos para la construcción de un prototipo de baja calidad, así como los insumos necesarios para la generación del catálogo de requisitos según el estándar IEEE 830-1998, cuya guía aparece en el documento de la Institute of Electrical and Electronics Engineers (1998).",Maestría en Ciencias Computacionales,"Submitted by Lesly Montalvo (leslymontalvof@hotmail.com) on 2018-09-11T21:27:38Z
No. of bitstreams: 1
Tesis Benjamín Tass Herrera.pdf: 115599613 bytes, checksum: f25ab9b27c191fdbd351d6875975a5b1 (MD5)||Made available in DSpace on 2018-09-11T21:27:38Z (GMT). No. of bitstreams: 1
Tesis Benjamín Tass Herrera.pdf: 115599613 bytes, checksum: f25ab9b27c191fdbd351d6875975a5b1 (MD5)
  Previous issue date: 2011",application/pdf,,https://dspace.um.edu.mx/handle/20.500.11972/533,spa,,Tecnología educativa||Enseñanza con ayuda de computadores||Educación virtual,"Integración de un marco de procesos para la captura de requisitos en plataformas de ambientes virtuales de aprendizaje interactivo, basado de la WWW",info:eu-repo/semantics/masterThesis
c0234c56-acfe-4cf6-a202-7e0c24368f3c,20.500.11972/441,,"Díaz Valladares, Ramón Andrés",,"Carballo Mendoza, Andrés",,2018-09-11T21:29:32Z,,2018-09-11T21:29:32Z,,2011,"La Universidad de Navojoa con el objetivo de preparar recurso humano que impactará
a empresas, hospitales, gobiernos, academias, tiene el compromiso de adquirir herramientas
tecnológicas de vanguardia que le ayuden a realizar sus labores cotidianas de una
forma práctica y sencilla.
 Al contar con una red jerárquica convergente podrá vincularse, darse a conocer,
competir e internacionalizarse al ofrecer servicios online que le permitan tener mayores ingresos
y alumnado.",Maestría en Ciencias Computacionales,"Submitted by Lesly Montalvo (leslymontalvof@hotmail.com) on 2018-09-11T21:29:32Z
No. of bitstreams: 1
Tesis Andrés Carballo Mendoza.pdf: 4918412 bytes, checksum: 54dee5c6b3ced0d4a3dae582bdd57b4e (MD5)||Made available in DSpace on 2018-09-11T21:29:32Z (GMT). No. of bitstreams: 1
Tesis Andrés Carballo Mendoza.pdf: 4918412 bytes, checksum: 54dee5c6b3ced0d4a3dae582bdd57b4e (MD5)
  Previous issue date: 2011",application/pdf,,https://dspace.um.edu.mx/handle/20.500.11972/534,spa,,Redes de Información||Arquitectura de redes de computadoras||Innovaciones tecnológicas||Tecnología de la información||Ethernet (Sistemas de redes de area local),"El modelo jerárquico, una innovación tecnológica en el desarrollo de infraestructura de red de la Universidad de Navojoa",info:eu-repo/semantics/masterThesis
32a93249-6538-490f-a8fd-3c0e89fb3483,20.500.11972/441,,"Hernández Rentería, Carlos Emilio",,"Vázquez García, Rafael",,2018-09-11T21:35:41Z,,2018-09-11T21:35:41Z,,2013,"Esta tesis concluye en que es necesaria una herramienta que optimice   la importancia de la correcta identificación del paciente y que sea
inmune a los problemas que se pueden presentan en la forma tradicional de identificar al mismo.",Maestría en Ciencias Computacionales,"Submitted by Lesly Montalvo (leslymontalvof@hotmail.com) on 2018-09-11T21:35:41Z
No. of bitstreams: 1
Tesis Rafael Vázquez García.pdf: 22376443 bytes, checksum: 400299fe6b355b84c9710fed22252570 (MD5)||Made available in DSpace on 2018-09-11T21:35:41Z (GMT). No. of bitstreams: 1
Tesis Rafael Vázquez García.pdf: 22376443 bytes, checksum: 400299fe6b355b84c9710fed22252570 (MD5)
  Previous issue date: 2013",application/pdf,,https://dspace.um.edu.mx/handle/20.500.11972/536,spa,,RFID - Innovaciones||Radio frecuencia - Identificación||Identificación de pacientes,Identificación de pacientes con tecnología RFID,info:eu-repo/semantics/masterThesis
