id,collection,dc.contributor.advisor,dc.contributor.advisor[],dc.contributor.author,dc.contributor.author[],dc.date.accessioned,dc.date.accessioned[],dc.date.available,dc.date.available[],dc.date.issued,dc.date.issued[],dc.description.abstract[],dc.description.abstract[es_MX],dc.description.provenance[en],dc.format[es_MX],dc.identifier.uri,dc.identifier.uri[],dc.language.iso[es_MX],dc.subject[],dc.subject[es_MX],dc.title[es_MX],dc.type[es_MX]
8b351235-87bc-40e3-8bd6-26b365a64604,20.500.11972/440,"Rodríguez Antonio, Raúl",,"Martínez Hernández, Jennie Lizbeth",,2019-11-14T17:53:29Z,,2019-11-14T17:53:29Z,,2015,,"Este artículo busca identificar los factores predictores de la humedad en proteína de soya texturizada. En la elaboración de proteína de soya texturizada (PST), con base en harina de soya desgrasada, por medio de mezclado, extrusión y secado, una de las características de calidad relevante es el porcentaje de humedad del producto terminado (HPT). Para efectos del control de calidad es de interés determinar los factores que tienen un efecto significativo sobre el HPT. Con base en lluvia de ideas y diagramas de Ishikawa se identificaron factores preliminares, para conformar una hoja de verificación, que conjuntamente con la aplicación de cartas de control para individuales y estudios de capacidad, fue empleada para el monitoreo planificado del proceso de producción. Los factores candidatos fueron el porcentaje de humedad de la materia prima (x1), porcentaje de aceite en la materia prima(x2), cantidad de agua adicionada en la mezcla (x3) y temperatura del horno de secado (x4). El filtrado de factores predictores se llevó a cabo empleando regresión lineal múltiple, por medio de criterios de mejores subconjuntos y regresión por pasos. Se obtuvieron dos modelos de predicción, (x1; x4 y x1; x2 respectivamente). Ambos modelos fueron validados por medio de corridas confirmatorias. El estudio se llevó a cabo en una fábrica de alimentos del estado de Nuevo León, México. El nivel de significancia se fijó en 0.05. Para el análisis estadístico se usó el software Minitab 17.",Ingeniería I,"Submitted by Nestor Ramírez (neraz@um.edu.mx) on 2019-11-14T17:53:29Z
No. of bitstreams: 1
Trabajo de titulación de Jennie Lizbeth Martínez Hernández.pdf: 2144450 bytes, checksum: 5e1ab3e9b325fcb2d438bfc79a87f0b0 (MD5)||Made available in DSpace on 2019-11-14T17:53:29Z (GMT). No. of bitstreams: 1
Trabajo de titulación de Jennie Lizbeth Martínez Hernández.pdf: 2144450 bytes, checksum: 5e1ab3e9b325fcb2d438bfc79a87f0b0 (MD5)
  Previous issue date: 2015",application/pdf,https://dspace.um.edu.mx/handle/20.500.11972/1179,,spa,,Ingeniería Industrial y de Sistemas,Identificación de factores predictores de la humedad en proteína de soya texturizada,info:eu-repo/semantics/bachelorThesis
f00bdcd1-2eea-4fb3-9adf-8eccca225b5f,20.500.11972/440,,"Romo Cárdenas, Gerardo Salvador",,"Hernández Zacarías, Bettsy",,2019-11-14T18:33:54Z,,2019-11-14T18:33:54Z,,2015,,Ingeniería Industrial y de Sistemas,"Submitted by Nestor Ramírez (neraz@um.edu.mx) on 2019-11-14T18:33:54Z
No. of bitstreams: 1
Trabajo de titulación de Bettsy Hernández Zacarías.pdf: 5112028 bytes, checksum: 16cc0ba9d4b1312e141591aa88af22e8 (MD5)||Made available in DSpace on 2019-11-14T18:33:54Z (GMT). No. of bitstreams: 1
Trabajo de titulación de Bettsy Hernández Zacarías.pdf: 5112028 bytes, checksum: 16cc0ba9d4b1312e141591aa88af22e8 (MD5)
  Previous issue date: 2015",application/pdf,,https://dspace.um.edu.mx/handle/20.500.11972/1182,spa,Colesterol en la sangre,Óptica-Mediciones,Estudio de la medición de la prevalencia de colesterol total en suero de sangre por técnicas interferométricas,info:eu-repo/semantics/bachelorThesis
88f266f9-570d-46bc-82bd-c7153489fb8d,20.500.11972/440,,"Rodríguez Antonio, Raúl",,"Miguel Trinidad, Jhonatan",,2019-11-14T17:42:04Z,,2019-11-14T17:42:04Z,,2015,"Este artículo pretende analizar las variables asociadas a una intervención de exergamig. El tamaño de cohorte analizada fue n= 23. El rendimiento físico de los sujetos de prueba fue evaluado conforme a los protocolos de las pruebas de Leeds y Fitnessgram®, previo a la intervención de Exergaming empleando la plataforma Xbox 360® con sensor Kinect® , posteriormente se expusieron a la intervención de Exergaming que consistió en una hora diaria de actividad física, durante cuatro días a la semana por el periodo de cuatro semanas. Al concluir el periodo de la intervención de Exergaming se evaluó nuevamente el rendimiento físico. El rendimiento físico fue evaluado con base en doce variables agrupadas en cuatro componentes, Capacidad aeróbica, Corporal (IMC y porcentaje de grasa), Fuerza Resistencia muscular (abdominales, planchas, extensión del tronco), Flexibilidad (Alcanzar el pie derecho e izquierdo) y Psicomotriz (saltar la cuerda durante un minuto, salto de longitud, puntería y velocidad). Los resultados revelaron que las variables se agruparon por componentes y en ellas se pueden ver aquellas que la intervención ayudó a que aumentaran su capacidad física y disminuir el aspecto corporal.",Ingeniería Industrial y Sistemas,"Submitted by Nestor Ramírez (neraz@um.edu.mx) on 2019-11-14T17:42:04Z
No. of bitstreams: 1
Trabajo de Titulación de Jhonatan Miguel Trinidad.pdf: 1001479 bytes, checksum: 8afc0d55ff1db43796eaf337d5059a46 (MD5)||Made available in DSpace on 2019-11-14T17:42:04Z (GMT). No. of bitstreams: 1
Trabajo de Titulación de Jhonatan Miguel Trinidad.pdf: 1001479 bytes, checksum: 8afc0d55ff1db43796eaf337d5059a46 (MD5)
  Previous issue date: 2015",application/pdf,,https://dspace.um.edu.mx/handle/20.500.11972/1178,spa,Juegos electrónicos||Programación (computadores electrónicos),Obesidad en niños,Metodología estadística para el análisis de variables asociado a una intervención de Exergamig usando software R.,info:eu-repo/semantics/bachelorThesis
2d519324-7df9-4c97-95a9-f4a26f30df00,20.500.11972/440,,"Romo Cárdenas, Gerardo Salvador",,"Gallegos Bouchot, Enoc",,2019-11-14T16:47:35Z,,2019-11-14T16:47:35Z,,2015,"Este artículo busca estudiar los efectos causados en un ambiente controlado simulando algunos fenómenos atmosféricos, para analizar el comportamiento tanto del haz láser como el de las informaciones moduladas aplicadas a sistemas de comunicación en espacio abierto. Las comunicaciones ópticas en espacio abierto se refieren a la transmisión de un haz láser modulado a través de la atmósfera para establecer comunicación de información. Este trabajo propone un estudio preliminar de estos sistemas. Los resultados revelaron que ciertamente existe una limitante en la transmisión del haz láser a través del medio. En el método de esparcimiento parte de la señal es absorbida por el medio y redirigida a otras direcciones y una pequeña parte de esta logra llegar a su destino. En el método de polarización se puede observar que hay un grado específico donde gran parte de la señal es absorbida por los polarizadores emulando así el medio donde constantemente se ve la gran problemática absorción, entre más avanza la señal más riesgo de ser absorbida.",Ingeniería en Electrónica y Telecomunicación,"Submitted by Nestor Ramírez (neraz@um.edu.mx) on 2019-11-14T16:47:35Z
No. of bitstreams: 1
Trabajo de titulación de Enoc Gallegos Bouchot.pdf: 2227356 bytes, checksum: 49694089114035555c12c0163f41558e (MD5)||Made available in DSpace on 2019-11-14T16:47:35Z (GMT). No. of bitstreams: 1
Trabajo de titulación de Enoc Gallegos Bouchot.pdf: 2227356 bytes, checksum: 49694089114035555c12c0163f41558e (MD5)
  Previous issue date: 2015",application/pdf,,https://dspace.um.edu.mx/handle/20.500.11972/1176,spa,Comunicaciones ópticas,Polarización (luz),Estudio de los efectos atmosféricos en comunicaciones ópticas a espacio abierto,info:eu-repo/semantics/bachelorThesis
3925bf08-754b-4f73-97c9-28b70fe40ed2,20.500.11972/440,,"Romo Cárdenas, Gerardo Salvador",,"Álvarez González, Hugo Enrique",,2019-11-13T22:31:22Z,,2019-11-13T22:31:22Z,,2015,"Este artículo busca estudiar los efectos de la difracción y la polarización en un ambiente controlado simulando algunos fenómenos atmosféricos para analizar el comportamiento tanto del haz láser como el de información modulada aplicada a sistemas de comunicación en espacio abierto. Las comunicaciones ópticas en espacio abierto se refieren a la transmisión de un haz laser modulado a través de la atmósfera para establecer comunicación de información. Este trabajo propone un estudio preliminar de estos sistemas. En los experimentos de polarización se encontró que este fenómeno físico afecta a la transmisión del sistema FSO realizada por una modulación de PWM. se logra observar la disminución de voltaje en el fotodiodo receptor conforme el haz láser se va polarizando, tomando como referencia un voltaje alto en las terminales del receptor cuando transmite y un voltaje bajo cuando no transmite. Cuando el haz láser incidente no está polarizado, la transmisión es óptima y de calidad, en contraste cuando el haz láser incidente está polarizado la transmisión se debilita y disminuye la calidad.",Ingeniería en Electrónica y Telecomunicaciones,"Submitted by Nestor Ramírez (neraz@um.edu.mx) on 2019-11-13T22:31:22Z
No. of bitstreams: 1
Trabajo de Titulación de Hugo Enrique Álvarez González.pdf: 881207 bytes, checksum: 09647f93d375d1bae5bbfe5f43123b40 (MD5)||Made available in DSpace on 2019-11-13T22:31:22Z (GMT). No. of bitstreams: 1
Trabajo de Titulación de Hugo Enrique Álvarez González.pdf: 881207 bytes, checksum: 09647f93d375d1bae5bbfe5f43123b40 (MD5)
  Previous issue date: 2015",application/pdf,,https://dspace.um.edu.mx/handle/20.500.11972/1173,spa,Comunicaciones ópticas,Polarización (luz),Efecto de polarización y difracción del haz modulado por PWM en comunicación óptica de espacio abierto,info:eu-repo/semantics/bachelorThesis
5275fa83-48d5-4e67-8076-138005c95749,20.500.11972/440,,"Romo Cárdenas, Gerardo Salvador",,"Témich Escobedo, Héctor",,2019-11-14T16:30:36Z,,2019-11-14T16:30:36Z,,2015,"Este artículo pretende crear un proceso de adquisición de datos para la evaluación de daño genético para el conteo de micronúcleos de manera operativa estandarizada que sea funcional. Un micronúcleo (MN) se considera una aberración genética ya que se produce cuando hay pérdida total o parcial de la cromátida (brazos) que conforman el cromosoma, originando un nuevo núcleo de tamaño más pequeño que el primario, visible bajo el microscopio óptico [1]. Esto ocurre durante el anafase dando como resultado fragmentos cromosómicos acéntricos. Los hallazgos manifiestan que se tiene la intención de aplicar técnicas de procesamiento de imágenes como una herramienta alternativa de evaluación en el conteo de micronúcleos (MN), esta generara resultados de una manera más rápida, innovadora, sencilla, eficiente y confiable, para las personas encargadas en realizar el conteo.",Ingeniería en Sistemas Computacionales,"Submitted by Nestor Ramírez (neraz@um.edu.mx) on 2019-11-14T16:30:36Z
No. of bitstreams: 1
Trabajo de titulación de Héctor Témich Escobedo.pdf: 1640649 bytes, checksum: a6073585deebf6f58cf0bbab21412bdd (MD5)||Made available in DSpace on 2019-11-14T16:30:36Z (GMT). No. of bitstreams: 1
Trabajo de titulación de Héctor Témich Escobedo.pdf: 1640649 bytes, checksum: a6073585deebf6f58cf0bbab21412bdd (MD5)
  Previous issue date: 2015",application/pdf,,https://dspace.um.edu.mx/handle/20.500.11972/1175,spa,Núcleo celular||Procesamiento de imágenes,Nucléolos,Desarrollo de un software de reconocimiento y conteo de micronucleos basado en procesamiento de imágenes,info:eu-repo/semantics/bachelorThesis
5d381e01-ac07-4d4c-8d43-ca32864b6491,20.500.11972/440,,"Cruz Domínguez, Ignacio",,"Ortiz González, Iván Iyari",,2019-11-13T22:43:36Z,,2019-11-13T22:43:36Z,,2015,"Este artículo surge como respuesta a la necesidad de proporcionar un lugar de acceso a diferentes usuarios que componen el público de la escuela de medicina. Los cuales incluyen grupos tales como estudiantes, docentes hasta un público en general, proveyendo una plataforma de información, promoción y administración de los diferentes servicios que la carrera ofrece. Para el logro de los objetivos se llevó a cabo un análisis detallado de los requerimientos así como de la implementación de dicha plataforma utilizando Java Server Pages (JSP), tecnologías tales como HTML, CSS, Javascript y los frameworks, Bootstrap para el aspecto visual en computadores de escritorio y Jquery Mobile para el aspecto e interacción móvil, de tal manera la interacción de los usuarios con el contenido del sitio es de forma dinámica e intuitiva, así mismo se elaboró un esquema del sitio basado en los requerimientos recolectados y analizados, de esta forma el esquema se comprende de una mejor manera y es fácilmente extensible.",Ingeniería en Sistemas Computacionales,"Submitted by Nestor Ramírez (neraz@um.edu.mx) on 2019-11-13T22:43:36Z
No. of bitstreams: 1
Trabajo de titulación de Iván Iyari Ortiz González.pdf: 934338 bytes, checksum: 261537a2cd3181c15fbca7991f545c68 (MD5)||Made available in DSpace on 2019-11-13T22:43:36Z (GMT). No. of bitstreams: 1
Trabajo de titulación de Iván Iyari Ortiz González.pdf: 934338 bytes, checksum: 261537a2cd3181c15fbca7991f545c68 (MD5)
  Previous issue date: 2015",application/pdf,,https://dspace.um.edu.mx/handle/20.500.11972/1174,spa,Diseño de páginas web,Programas para computador,Implementación del front-end para la página Web principal de la escuela de medicina,info:eu-repo/semantics/bachelorThesis
d9d24fd5-24b9-4b2e-84f1-17b6b55ad591,20.500.11972/440,,"Garrido Soto, Alejandro",,"Hernández González, Hiram Isaí",,2019-10-29T21:03:12Z,,2019-10-29T21:03:12Z,,2014,"Este artículo se propone crear una UTR configurable y de bajo costo. Para esto es necesario crear la interfaz que comunica a la UTR con los sensores de los dispositivos en la red eléctrica, así como un software con interfaz gráfica que permita al operador, interpretar la información recibida en la UTR y enviar pulsos de control a los dispositivos de la red eléctrica. Este proyecto fue realizado con el fin de crear un prototipo de dicha interfaz junto con el software que lo controla. Se utilizó la tarjeta embebida PCDuino, como CPU del prototipo. Esta tarjeta utiliza el sistema operativo Linux, esta característica, da lugar a la programación con el lenguaje Python. El circuito electrónico fue diseñado con Proteus 8 Professional, el cual es un software especializado en la simulación y creación de tarjetas de circuitos impresos denominados PCB por sus siglas en inglés (Printed Circuit Board). El software fue programado con el lenguaje de programación Python utilizando la librería para interfaz gráfica Tkinter. Resultados: Se creó un prototipo capaz de recibir pulsos digitales y enviar un pulso digital de control, controlado por una interfaz gráfica configurable, que guarda un log de eventos por segundo, programada en Python. Concluyendo así, que es factible crear una interfaz entre los dispositivos de la red eléctrica y la UTR, que reciba y envíe pulsos digitales, para el control y monitorización de los dispositivos instalados en las redes eléctricas.",Ingeniería en Electronica y Telecomunicaciones,"Submitted by Nestor Ramírez (neraz@um.edu.mx) on 2019-10-29T21:03:12Z
No. of bitstreams: 1
Proyecto de Hiram Isaí Hernández González.pdf: 7770979 bytes, checksum: bda4dc8484519ed97e88f816ffb358fc (MD5)||Made available in DSpace on 2019-10-29T21:03:12Z (GMT). No. of bitstreams: 1
Proyecto de Hiram Isaí Hernández González.pdf: 7770979 bytes, checksum: bda4dc8484519ed97e88f816ffb358fc (MD5)
  Previous issue date: 2014",application/pdf,,https://dspace.um.edu.mx/handle/20.500.11972/1162,spa,Interfases con el usuario (sistemas para computador),Distribución de energía eléctrica,Diseño y construcción de una interfaz para comunicar los dispositivos de la red eléctrica con la unidad terminal remota,info:eu-repo/semantics/bachelorThesis
fc79f625-ee7c-47f5-922d-9637f6de3ebd,20.500.11972/440,,"Romo Cárdenas, Gerardo Salvador",,"Vázquez Gordillo, Edison Jessie",,2019-11-13T20:07:42Z,,2019-11-13T20:07:42Z,,2015,"For the development of this project an exploration of literature based on negative pressure in order to increase knowledge about the different types of wounds, healing methods and their classification was performed. Likewise a literature review was performed with respect to different vacuum pump technologies to observe the mechanical components of this. Finally, considering the results of the previous stage, we worked on the design and construction of prototype vacuum pump (Fig. 1) which is composed of an alternate engine Matsushita Electric UDS1401SM current 500W able to exert a negative pressure less than the 5mmHg inside a drain pan with 1 liter. This pressure is regulated by an industrial DIMMER and monitored by a vacuum gauge 30 mmHg RITER; these components are structured through copper pipes from other welding materials.  Results No significant violation of the assumptions of the model residuals was found. ANOVA model fit was 26.21%. Outliers one observed in the number 10 shows the level 1028 at the value of that sample was ignored.",Ingeniería Industrial y de Sistemas,"Submitted by Nestor Ramírez (neraz@um.edu.mx) on 2019-11-13T20:07:41Z
No. of bitstreams: 1
Trabajo de titulación de Edison Jessie Vázquez Gordillo.pdf: 305266 bytes, checksum: 07d8e8895da336ea4cda50e59c9f40a5 (MD5)||Made available in DSpace on 2019-11-13T20:07:42Z (GMT). No. of bitstreams: 1
Trabajo de titulación de Edison Jessie Vázquez Gordillo.pdf: 305266 bytes, checksum: 07d8e8895da336ea4cda50e59c9f40a5 (MD5)
  Previous issue date: 2015",application/pdf,,https://dspace.um.edu.mx/handle/20.500.11972/1169,eng,Heridas,Desarrollo científico y tecnológico,Desarrollo de prototipo de generación de vacío para tratamiento de presión negativa en heridas crónicas a nivel laboratorio,info:eu-repo/semantics/bachelorThesis
162be320-c800-43f4-81ed-7816bea96021,20.500.11972/440,,"Hernández Rentería, Carlos Emilio",,"Hernández Vázquez, Abisay",,2019-11-13T17:10:54Z,,2019-11-13T17:10:54Z,,2015,"Esta investigación parte de un diseño físico de la red inalámbrica con el objetivo de lograr una mayor cobertura de la señal dentro de los edificios de las facultades pertenecientes a la Universidad de Montemorelos. El estudio se realiza mediante el software de simulación llamado Visual RF Plan, mismo que permite hacer un análisis de los edificios mediante planos arquitectónicos del lugar, tomando en cuenta el material de construcción, ventanas, tipo de aplicaciones y demás características importantes para la propagación de la señal. Se plantea el uso de tecnologías 802.11n y 802.11ac, de acuerdo a las ventajas que dan por el manejo de su frecuencia y la tendencia de la tecnología WI-FI, con el diseño que se propone para cada facultad se espera que la movilidad de los usuarios sea total y que tengan acceso en cualquier parte de sus facultades.",Ingeniería en Electrónica y Telecomunicaciones,"Submitted by Nestor Ramírez (neraz@um.edu.mx) on 2019-11-13T17:10:54Z
No. of bitstreams: 1
Trabajo de titulación de Abisay Hernández Vázquez.pdf: 1696467 bytes, checksum: 68374b5d16727d6755bcf3af44a3020d (MD5)||Made available in DSpace on 2019-11-13T17:10:54Z (GMT). No. of bitstreams: 1
Trabajo de titulación de Abisay Hernández Vázquez.pdf: 1696467 bytes, checksum: 68374b5d16727d6755bcf3af44a3020d (MD5)
  Previous issue date: 2015",application/pdf,,https://dspace.um.edu.mx/handle/20.500.11972/1168,spa,Intranets (redes de computadores),Seguridad en computadores,Movilidad inteligente: diseño WLAN UM,info:eu-repo/semantics/bachelorThesis
f9e3acfb-536f-4f5d-8de4-b1d89fed59b2,20.500.11972/440,,"Cruz Domínguez, Ignacio",,"Beristain Cortes, Azareel",,2019-11-13T16:14:36Z,,2019-11-13T16:14:36Z,,2016,"Este articulo está basado en el desarrollo de una herramienta para la simulación del comportamiento de objetos en 3D de la física básica utilizando el motor gráfico Unity como herramienta de desarrollo. Esta herramienta muestra la información realizando los cálculos con las fórmulas para cada caso presentado. Esto ayudará a estudiantes del área de física básica a comprender con mayor facilidad, de la misma forma los docentes podrán usar esta herramienta de simulación para la enseñanza a sus alumnos. En este trabajo se realiza la simulación de caída libre, plano inclinado y vectores.",Ingeniería en Sistemas Computacionales,"Submitted by Nestor Ramírez (neraz@um.edu.mx) on 2019-11-13T16:14:36Z
No. of bitstreams: 1
Trabajo de titulación de  Azareel Beristain Cortes.pdf: 7384784 bytes, checksum: 28a827be73c5ab008f175475860dfebe (MD5)||Made available in DSpace on 2019-11-13T16:14:36Z (GMT). No. of bitstreams: 1
Trabajo de titulación de  Azareel Beristain Cortes.pdf: 7384784 bytes, checksum: 28a827be73c5ab008f175475860dfebe (MD5)
  Previous issue date: 2016",application/pdf,,https://dspace.um.edu.mx/handle/20.500.11972/1165,spa,Procesamiento digital de imágenes,Física-enseñanza,Desarrollo de un entorno de simulación 3D como herramienta de apoyo para la enseñanza de la física,info:eu-repo/semantics/bachelorThesis
2548db3c-56d9-441b-a3d8-5d11110705d7,20.500.11972/440,,"Sosa Herrera, Melquiades Alejandro",,"Garza Llanas, Viviana",,2019-10-25T14:30:17Z,,2019-10-25T14:30:17Z,,2014,"El propósito de la investigación es conocer las medidas y características estándar de las tablas para la realización de gabinetes de cocina más utilizadas y mejorar su proceso de corte. Se propuso un método para estandarizar los procesos, la Mesa-plantilla, para los cortes de algunas piezas de los gabinetes con una sierra portátil. Para la comparación de los tiempos de los procesos en cada método fue requerida la utilización del software estadístico Minitab®. Los resultados fueron tres tipos de tamaño en gabinetes y al comparar los tiempos de la mesa plantilla y el tradicional no es más rápida la mesa-plantilla.",Ingeniera Industrial  y de Sistemas,"Submitted by Nestor Ramírez (neraz@um.edu.mx) on 2019-10-25T14:30:17Z
No. of bitstreams: 1
Proyecto de Viviana Garza Llanas.pdf: 1031354 bytes, checksum: aab13e7d03b4822fa27f50e24d3cc596 (MD5)||Made available in DSpace on 2019-10-25T14:30:17Z (GMT). No. of bitstreams: 1
Proyecto de Viviana Garza Llanas.pdf: 1031354 bytes, checksum: aab13e7d03b4822fa27f50e24d3cc596 (MD5)
  Previous issue date: 2014",application/pdf,,https://dspace.um.edu.mx/handle/20.500.11972/1147,spa,Trabajos en madera||Ingeniería industrial,Carpintería,Desarrollo de un plan de estandarización para la Carpintería MODUMART de la Universidad de Montemorelos,info:eu-repo/semantics/bachelorThesis
362753f4-b1bb-4a1e-9029-92fe56ca4e6d,20.500.11972/440,,"Romo Cárdenas, Gerardo Salvador",,"Domínguez Domínguez, Rúsbel",,2019-10-25T14:49:34Z,,2019-10-25T14:49:34Z,,2014,"Esta investigación busca desarrollar un espectrómetro de bajo costo. Los resultados revelaron que el desarrollo de una fuente de luz para la irradiación de las muestras es uno de los logros, al igual que el desarrollo del espectrómetro que de igual forma es esencial para el estudio de reflectancia difusa. El funcionamiento del espectrómetro de bajo costo es muy bueno al realizar análisis de diversas muestras, se observa ocularmente la similitud de las gráficas de reflexión de los espectros. La metodología usada para la medición de muestras funciona correctamente, así como el protocolo propuesto para realizar los estudios de reflectancia difusa, al generar dispersión en las muestras coloides se asemejan a piel humana.",Ingeniería en Electrónica y Telecomunicaciones,"Submitted by Nestor Ramírez (neraz@um.edu.mx) on 2019-10-25T14:49:34Z
No. of bitstreams: 1
Proyecto de Rúsbel Domínguez Domínguez.pdf: 1742367 bytes, checksum: 1b50e46389e734de9a917ca19f82ff72 (MD5)||Made available in DSpace on 2019-10-25T14:49:34Z (GMT). No. of bitstreams: 1
Proyecto de Rúsbel Domínguez Domínguez.pdf: 1742367 bytes, checksum: 1b50e46389e734de9a917ca19f82ff72 (MD5)
  Previous issue date: 2014",application/pdf,,https://dspace.um.edu.mx/handle/20.500.11972/1149,spa,Piel||Dermatología,Espectroscopia de reflectancia,Desarrollo de un espectrómetro de bajo costo y desarrollo de una fuente de luz de amplio espectro para estudios de reflectancia difusa.,info:eu-repo/semantics/bachelorThesis
